    1   0.000000    127.0.0.1 → 127.0.0.1    TCP 74 47254 → 8080 [SYN] Seq=0 Win=65495 Len=0 MSS=65495 SACK_PERM TSval=2523847343 TSecr=0 WS=128
    2   0.000045    127.0.0.1 → 127.0.0.1    TCP 74 8080 → 47254 [SYN, ACK] Seq=0 Ack=1 Win=65483 Len=0 MSS=65495 SACK_PERM TSval=2523847343 TSecr=2523847343 WS=128
    3   0.000054    127.0.0.1 → 127.0.0.1    TCP 66 47254 → 8080 [ACK] Seq=1 Ack=1 Win=65536 Len=0 TSval=2523847343 TSecr=2523847343
    4   9.358320    127.0.0.1 → 127.0.0.1    TCP 92 47254 → 8080 [PSH, ACK] Seq=1 Ack=1 Win=65536 Len=26 TSval=2523856701 TSecr=2523847343 [TCP segment of a reassembled PDU]
    5   9.358354    127.0.0.1 → 127.0.0.1    TCP 66 8080 → 47254 [ACK] Seq=1 Ack=27 Win=65536 Len=0 TSval=2523856701 TSecr=2523856701
    6  12.719347    127.0.0.1 → 127.0.0.1    TCP 166 47254 → 8080 [PSH, ACK] Seq=27 Ack=1 Win=65536 Len=100 TSval=2523860062 TSecr=2523856701
    7  12.719378    127.0.0.1 → 127.0.0.1    TCP 66 8080 → 47254 [ACK] Seq=1 Ack=127 Win=65536 Len=0 TSval=2523860062 TSecr=2523860062
    8  12.719924    127.0.0.1 → 127.0.0.1    TCP 166 47254 → 8080 [PSH, ACK] Seq=127 Ack=1 Win=65536 Len=100 TSval=2523860063 TSecr=2523860062
    9  12.719926    127.0.0.1 → 127.0.0.1    TCP 66 8080 → 47254 [ACK] Seq=1 Ack=227 Win=65536 Len=0 TSval=2523860063 TSecr=2523860063
   10  12.720296    127.0.0.1 → 127.0.0.1    TCP 166 47254 → 8080 [PSH, ACK] Seq=227 Ack=1 Win=65536 Len=100 TSval=2523860063 TSecr=2523860063
   11  12.720297    127.0.0.1 → 127.0.0.1    TCP 66 8080 → 47254 [ACK] Seq=1 Ack=327 Win=65536 Len=0 TSval=2523860063 TSecr=2523860063
   12  12.720939    127.0.0.1 → 127.0.0.1    TCP 73 47254 → 8080 [PSH, ACK] Seq=327 Ack=1 Win=65536 Len=7 TSval=2523860064 TSecr=2523860063
   13  12.720955    127.0.0.1 → 127.0.0.1    TCP 66 8080 → 47254 [ACK] Seq=1 Ack=334 Win=65536 Len=0 TSval=2523860064 TSecr=2523860064
   14  12.721349    127.0.0.1 → 127.0.0.1    TCP 66 47254 → 8080 [FIN, ACK] Seq=334 Ack=1 Win=65536 Len=0 TSval=2523860064 TSecr=2523860064
   15  12.722555    127.0.0.1 → 127.0.0.1    TCP 66 8080 → 47254 [FIN, ACK] Seq=1 Ack=335 Win=65536 Len=0 TSval=2523860065 TSecr=2523860064
   16  12.722628    127.0.0.1 → 127.0.0.1    TCP 66 47254 → 8080 [ACK] Seq=335 Ack=2 Win=65536 Len=0 TSval=2523860066 TSecr=2523860065
   17  17.166469    127.0.0.1 → 127.0.0.1    TCP 74 34996 → 8080 [SYN] Seq=0 Win=65495 Len=0 MSS=65495 SACK_PERM TSval=2523864509 TSecr=0 WS=128
   18  17.166489    127.0.0.1 → 127.0.0.1    TCP 74 8080 → 34996 [SYN, ACK] Seq=0 Ack=1 Win=65483 Len=0 MSS=65495 SACK_PERM TSval=2523864509 TSecr=2523864509 WS=128
   19  17.166499    127.0.0.1 → 127.0.0.1    TCP 66 34996 → 8080 [ACK] Seq=1 Ack=1 Win=65536 Len=0 TSval=2523864509 TSecr=2523864509
   20  19.305601    127.0.0.1 → 127.0.0.1    TCP 92 34996 → 8080 [PSH, ACK] Seq=1 Ack=1 Win=65536 Len=26 TSval=2523866649 TSecr=2523864509 [TCP segment of a reassembled PDU]
   21  19.305644    127.0.0.1 → 127.0.0.1    TCP 66 8080 → 34996 [ACK] Seq=1 Ack=27 Win=65536 Len=0 TSval=2523866649 TSecr=2523866649
   22  22.890870    127.0.0.1 → 127.0.0.1    TCP 166 34996 → 8080 [PSH, ACK] Seq=27 Ack=1 Win=65536 Len=100 TSval=2523870234 TSecr=2523866649
   23  22.890897    127.0.0.1 → 127.0.0.1    TCP 66 8080 → 34996 [ACK] Seq=1 Ack=127 Win=65536 Len=0 TSval=2523870234 TSecr=2523870234
   24  22.891018    127.0.0.1 → 127.0.0.1    TCP 166 34996 → 8080 [PSH, ACK] Seq=127 Ack=1 Win=65536 Len=100 TSval=2523870234 TSecr=2523870234
   25  22.891020    127.0.0.1 → 127.0.0.1    TCP 66 8080 → 34996 [ACK] Seq=1 Ack=227 Win=65536 Len=0 TSval=2523870234 TSecr=2523870234
   26  22.891188    127.0.0.1 → 127.0.0.1    TCP 166 34996 → 8080 [PSH, ACK] Seq=227 Ack=1 Win=65536 Len=100 TSval=2523870234 TSecr=2523870234
   27  22.891189    127.0.0.1 → 127.0.0.1    TCP 66 8080 → 34996 [ACK] Seq=1 Ack=327 Win=65536 Len=0 TSval=2523870234 TSecr=2523870234
   28  22.891427    127.0.0.1 → 127.0.0.1    TCP 73 34996 → 8080 [PSH, ACK] Seq=327 Ack=1 Win=65536 Len=7 TSval=2523870234 TSecr=2523870234
   29  22.891515    127.0.0.1 → 127.0.0.1    TCP 66 8080 → 34996 [ACK] Seq=1 Ack=334 Win=65536 Len=0 TSval=2523870234 TSecr=2523870234
   30  22.891962    127.0.0.1 → 127.0.0.1    TCP 66 34996 → 8080 [FIN, ACK] Seq=334 Ack=1 Win=65536 Len=0 TSval=2523870235 TSecr=2523870234
   31  22.892547    127.0.0.1 → 127.0.0.1    TCP 66 8080 → 34996 [FIN, ACK] Seq=1 Ack=335 Win=65536 Len=0 TSval=2523870235 TSecr=2523870235
   32  22.892566    127.0.0.1 → 127.0.0.1    TCP 66 34996 → 8080 [ACK] Seq=335 Ack=2 Win=65536 Len=0 TSval=2523870236 TSecr=2523870235
   33  24.573999    127.0.0.1 → 127.0.0.1    TCP 74 33292 → 8080 [SYN] Seq=0 Win=65495 Len=0 MSS=65495 SACK_PERM TSval=2523872807 TSecr=0 WS=128
   34  24.574008    127.0.0.1 → 127.0.0.1    TCP 74 8080 → 33292 [SYN, ACK] Seq=0 Ack=1 Win=65483 Len=0 MSS=65495 SACK_PERM TSval=2523872807 TSecr=2523872807 WS=128
   35  24.574016    127.0.0.1 → 127.0.0.1    TCP 66 33292 → 8080 [ACK] Seq=1 Ack=1 Win=65536 Len=0 TSval=2523872807 TSecr=2523872807
   36  27.959088    127.0.0.1 → 127.0.0.1    TCP 92 33292 → 8080 [PSH, ACK] Seq=1 Ack=1 Win=65536 Len=26 TSval=2523876192 TSecr=2523872807 [TCP segment of a reassembled PDU]
   37  27.959119    127.0.0.1 → 127.0.0.1    TCP 66 8080 → 33292 [ACK] Seq=1 Ack=27 Win=65536 Len=0 TSval=2523876192 TSecr=2523876192
   38  31.130676    127.0.0.1 → 127.0.0.1    TCP 166 33292 → 8080 [PSH, ACK] Seq=27 Ack=1 Win=65536 Len=100 TSval=2523879363 TSecr=2523876192
   39  31.130706    127.0.0.1 → 127.0.0.1    TCP 66 8080 → 33292 [ACK] Seq=1 Ack=127 Win=65536 Len=0 TSval=2523879363 TSecr=2523879363
   40  31.130805    127.0.0.1 → 127.0.0.1    TCP 166 33292 → 8080 [PSH, ACK] Seq=127 Ack=1 Win=65536 Len=100 TSval=2523879363 TSecr=2523879363
   41  31.130806    127.0.0.1 → 127.0.0.1    TCP 66 8080 → 33292 [ACK] Seq=1 Ack=227 Win=65536 Len=0 TSval=2523879363 TSecr=2523879363
   42  31.130937    127.0.0.1 → 127.0.0.1    TCP 166 33292 → 8080 [PSH, ACK] Seq=227 Ack=1 Win=65536 Len=100 TSval=2523879363 TSecr=2523879363
   43  31.130939    127.0.0.1 → 127.0.0.1    TCP 66 8080 → 33292 [ACK] Seq=1 Ack=327 Win=65536 Len=0 TSval=2523879363 TSecr=2523879363
   44  31.131137    127.0.0.1 → 127.0.0.1    TCP 73 33292 → 8080 [PSH, ACK] Seq=327 Ack=1 Win=65536 Len=7 TSval=2523879364 TSecr=2523879363
   45  31.131138    127.0.0.1 → 127.0.0.1    TCP 66 8080 → 33292 [ACK] Seq=1 Ack=334 Win=65536 Len=0 TSval=2523879364 TSecr=2523879364
   46  31.131422    127.0.0.1 → 127.0.0.1    TCP 66 33292 → 8080 [FIN, ACK] Seq=334 Ack=1 Win=65536 Len=0 TSval=2523879364 TSecr=2523879364
   47  31.131844    127.0.0.1 → 127.0.0.1    TCP 66 8080 → 33292 [FIN, ACK] Seq=1 Ack=335 Win=65536 Len=0 TSval=2523879364 TSecr=2523879364
   48  31.131861    127.0.0.1 → 127.0.0.1    TCP 66 33292 → 8080 [ACK] Seq=335 Ack=2 Win=65536 Len=0 TSval=2523879364 TSecr=2523879364
